"Unnamed: 0","label_1","label_2","passage_1","passage_2","score_1","score_2","SE_Thresh","dataset"
23,1.0,0.0,"Quite easily, the best pho in Charlotte. It's currently a four-star rating, but that's only because I haven't tried the rest of their dishes. One less star just means there's room to grow - I don't want to cap its potential! This place is a bit under the radar. Everyone raves about Vietnam Grille, Pho Hoa, Saigon Palace, etc. but none of them beat the pho at Doan's. It's time to blow this place up and let everyone know: The broth is unbeatable. Have you made ramen noodles and poured in that powder soup base? The directions generally say you should add the powder after the water is boiling. What ends up happening is that the soup still just tastes a bit watery and bland. Sure, it's fully dissolved, but it's different from when you just pour the powder in with the water, pre-boil. (Yeah, I'm a ramen master... I got accoutrements you can't even imagine!). So... back to the broth - it's nowhere near bland and doesn't have too much star anise, cinnamon, or whatever spice gives it a light sweet taste. Doan's might be under the radar for the general public, but apparently Vietnamese people know what's up. It's always a good sign when there's a bunch of Vietnamese people in a Vietnamese restaurant, dontcha think? They have options, but they choose to come here. Service Highlight - We got all of the limes that are table wanted. Lime shortage? Ain't nobody got time for that? Certainly not Doan's. They're not sheisty with their limes. (Really? A shortage of limes causing its price to spike? It's a friggin' lime, but I digress.) I'm a fan. Pho lovers, give this place a shot. dmo out.","Quite easily, the best pho in Charlotte. It's currently a four-star rating, but that's only because I haven't tried the rest of their dishes. One fewer star just means there's room to grow - I don't want to cap its potential! This place is a bit under the radar. Everyone raves about Vietnam Grille, Pho Hoa, Saigon Palace, etc. but none of them trounced the pho at Doan's. It's time to blow this place up and let everyone know: The broth is unstoppable. Have you made ramen noodles and poured in that powder soup base? The directions normally say you should add the powder after the water is boiling. What ends up happening is that the soup still just tastes a bite watery and bland. Sure, it's fully dissolved, but it's dissimilar from when you just pour the powder in with the water, pre-boil. (Yeah, I'm a ramen master... I got accoutrements you can't even imagine!). So... back to the broth - it's nowhere near bland and doesn't have too much star anise, cinnamon, or whatever spice gives it a light sweet taste. Doan's might be under the radar for the general public, but apparently Vietnamese people know what's up. It's always a good sign when there's a bunch of Vietnamese people in a Vietnamese restaurant, dontcha think? They have options, but they choose to come here. Service Highlight - We got all of the limes that are table wanted. Lime shortage? Ain't nobody got time for that? Certainly not Doan's. They're not sheisty with their limes. (Really? A shortage of limes causing its price to spike? It's a friggin' lime, but I digress.) I'm a fan. Pho lovers, give this place a shot. dmo out.",0.9858078956604004,0.5768725872039795,0.97,"yelp-sentiment"
55,0.0,1.0,"Okay, you have: Penelope Keith as Miss Herringbone-Tweed, B.B.E. (Backbone of England.) She's killed off in the first scene - that's right, folks; this show has no backbone! Peter O'Toole as Ol' Colonel Cricket from The First War and now the emblazered Lord of the Manor. Joanna Lumley as the ensweatered Lady of the Manor, 20 years younger than the colonel and 20 years past her own prime but still glamourous (Brit spelling, not mine) enough to have a toy-boy on the side. It's alright, they have Col. Cricket's full knowledge and consent (they guy even comes 'round for Christmas!) Still, she's considerate of the colonel enough to have said toy-boy her own age (what a gal!) David McCallum as said toy-boy, equally as pointlessly glamourous as his squeeze. Pilcher couldn't come up with any cover for him within the story, so she gave him a hush-hush job at the Circus. and finally: Susan Hampshire as Miss Polonia Teacups, Venerable Headmistress of the Venerable Girls' Boarding-School, serving tea in her office with a dash of deep, poignant advice for life in the outside world just before graduation. Her best bit of advice: ""I've only been to Nancherrow (the local Stately Home of England) once. I thought it was very beautiful but, somehow, not part of the real world."" Well, we can't say they didn't warn us. Ah, Susan - time was, your character would have been running the whole show. They don't write 'em like that any more. Our loss, not yours. So - with a cast and setting like this, you have the re-makings of ""Brideshead Revisited,"" right? Wrong! They took these 1-dimensional supporting roles because they paid so well. After all, acting is one of the oldest temp-jobs there is (YOU name another!) First warning sign: lots and lots of backlighting. They get around it by shooting outdoors - ""hey, it's just the sunlight!"" Second warning sign: Leading Lady cries a lot. When not crying, her eyes are moist. That's the law of romance novels: Leading Lady is ""dewy-eyed."" Henceforth, Leading Lady shall be known as L.L. Third warning sign: L.L. actually has stars in her eyes when she's in love. Still, I'll give Emily Mortimer an award just for having to act with that spotlight in her eyes (I wonder . did they use contacts?) And lastly, fourth warning sign: no on-screen female character is ""Mrs."" She's either ""Miss"" or ""Lady."" When all was said and done, I still couldn't tell you who was pursuing whom and why. I couldn't even tell you what was said and done. To sum up: they all live through World War II without anything happening to them at all. OK, at the end, L.L. finds she's lost her parents to the Japanese prison camps and baby sis comes home catatonic. Meanwhile (there's always a ""meanwhile,"") some young guy L.L. had a crush on (when, I don't know) comes home from some wartime tough spot and is found living on the street by Lady of the Manor (must be some street if SHE's going to find him there.) Both war casualties are whisked away to recover at Nancherrow (SOMEBODY has to be ""whisked away"" SOMEWHERE in these romance stories!) Great drama.","Okay, you have: Penelope Keith as Miss Herringbone-Tweed, B.B.E. (Backbone of England.) She's slain off in the first scene - that's right, folks; this show ha no linchpin! Peter O'Toole as Ol' Colonel Cricket from The First War and now the emblazered Seigneur of the Manor. Joanna Lumley as the ensweatered Lady of the Manor, 20 years younger than the colonel and 20 years past her own prime but still glamourous (Brit spelling, not mine) enough to have a toy-boy on the side. It's okay, they have Col. Cricket's full knowledge and consent (they fella even comes 'rounded for Christmas!) Still, she's considerate of the colonel enough to ha says toy-boy her own age (what a gal!) David McCallum as say toy-boy, equally as pointlessly glamourous as his squeeze. Pilcher couldn't come up with any cover for him within the stories, so she yielded him a hush-shh job at the Circus. and eventually: Susan Hampshire as Mademoiselle Polonia Teacups, Venerable Headmistress of the Venerable Girls' Boarding-School, serving tea in her office with a dash of deep, poignant advice for life in the outside world just before graduation. Her best bit of advice: ""I've only been to Nancherrow (the local Stately Home of England) once. I thought it was very beautiful but, somehow, not part of the real world."" Well, we can't say they didn't warn us. Ah, Susan - time was, your character would have been running the whole show. They don't write 'em like that any more. Our loss, not yours. So - with a cast and setting like this, you have the re-makings of ""Brideshead Revisited,"" right? Wrong! They took these 1-dimensional supporting roles because they paid so well. After all, acting is one of the oldest temp-jobs there is (YOU name another!) First warning sign: lots and lots of backlighting. They get around it by shooting outdoors - ""hey, it's just the sunlight!"" Second cautionary sign: Leading Lady cries a lot. When not crying, her eyes are moist. That's the law of romance novels: Leading Lady is ""dewy-eyed."" Henceforth, Leading Lady shall be known as L.L. Third warning sign: L.L. actually has stars in her eyes when she's in love. Still, I'll give Emily Mortimer an award just for having to act with that spotlight in her eyes (I wonder . did they use contacts?) And lastly, fourth warning sign: no on-screen female character is ""Mrs."" She's either ""Miss"" or ""Lady."" When all was said and done, I still couldn't tell you who was pursuing whom and why. I couldn't even tell you what was said and done. To sum up: they all live through World War II without anything happening to them at all. OK, at the end, L.L. finds she's lost her parents to the Japanese prison camps and baby sis comes home catatonic. Meanwhile (there's always a ""meanwhile,"") some young guy L.L. had a crush on (when, I don't know) comes home from some wartime tough spot and is found living on the street by Lady of the Manor (must be some street if SHE's going to find him there.) Both war casualties are whisked away to recover at Nancherrow (SOMEBODY has to be ""whisked away"" SOMEWHERE in these romance stories!) Great drama.",0.766274094581604,0.5189623236656189,0.96,"imdb"
3,0.0,1.0,"what kind of sh*t is this? Power rangers vs Freddy? It was watchable and as good as the first film in the beginning but from the part where the protagonists get super powers in theirs dreams, it started to become childish. This sh*t should have been rated PG or PG-13 rather than R. I expected to see some very mature stuff but it was only for the 1/3 of the film. The rest are for little kids. Plus it's focused too much on Christianity. I know Freddy's a demon but there are many religions that have different ways to fight demons. Why does it always have to be Christianity? This is total Orientalism and filled with white men/westerner's superiority. Don't' watch this, show it to little kids who loves power rangers.","what kind of sh*t is this? Power rangers vs Freddy? It was watchable and as good as the first films in the beginning but from the portion where the protagonists get super powers in theirs dreams, it initiating to become childlike. This sh*t should have been rated PG or PG-13 rather than R. I anticipated to see some very mature stuff but it was only for the 1/3 of the film. The rest are for little kids. Anymore it's focused too much on Christianity. I know Freddy's a demon but there are many religious that have different ways to fight demons. Why does it always have to be Christianity? This is aggregate Orientalism and fills with white men/westerner's superiority. Don't' watch this, shows it to little kids who loves power rangers.",0.9269660711288452,0.505366325378418,0.96,"imdb"
5,0.0,1.0,"the big-screen scooby makes the silly original cartoon seem smart and well-crafted in comparison .","the big-screen scooby makes the silly original cartoon seems smart and well-crafted in compares .",0.7297303676605225,0.6846239566802979,0.99,"mr"
9,1.0,0.0,"I have been here on multiple occasions. The burgers are very good. Nice selection of beer on draft. Milkshakes are very good. Forget the wings unless your feeding a five year old. The wings looked like they were from a quail, they were so small. It's a burger, beer and shakes place.","I have been here on various occasions. The burgers are very good. Nice choosing of beer on drafted. Milkshakes are very good. Forget the wings unless your feeding a five year elderly. The wings looked like they were from a quail, they were so small. It's a burger, beer and shaking placing.",0.7966216802597046,0.5220826268196106,0.96,"yelp-sentiment"
54,0.0,1.0,"Evidently lots of people really like this, but I found it infantilising and reasonably offensive codswallop, saved from oblivion by Jane Russell and a couple of memorable musical numbers, especially the opener (but there's a marked dip in invention later on). I don't get on with Monroe - she's supposed to be playing a dumb blonde who ain't that dumb, but she just comes over as dumb. Russell can't quite convince when she claims never to have been in a gymnasium, but is otherwise rather wonderful. The men are staggeringly uninteresting, as is the plot. By no means atrocious, but so patchy that, if this is a classic, God help us all.","Apparently lots of people genuinely like this, but I found it infantilising and reasonably insulting codswallop, rescued from oblivion by Jane Russell and a couple of memorable musical numbers, particularly the opener (but there's a marked dip in invention subsequently on). I don't got on with Monroe - she's presumed to be play a dumb blonde who ain't that dumb, but she just happens over as dumb. Russell can't pretty persuade when she claims never to ha been in a gymnasium, but is otherwise rather wondrous. The men are surprisingly uninteresting, as is the plot. By no means horrible, but so patchy that, if this is a classic, Gods support us all.",0.986985981464386,0.6182809472084045,0.96,"imdb"
25,1.0,0.0,"My grotesque, hideous, and miserly appearance does not lend itself well to the medium of film, and so I've never really taken much to the art of photos. There's also nothing more dull than being subjected to a neverending stream of Polaroids from someones tedious night out with their ""wacky"" mates, and so I tend to keep my lifetimes memories in my head, rather than resort to images of awkwardly posed, contrived snapshots where everyone is holding up a shot glass, and has demonic eyes. I'm not sure where this dislike of artificially produced images comes from. I do remember an incident when I was about 10, when I borrowed my brother's video camera and unearthed a somewhat disturbing recorded sequence which consisted solely of him waving his cock about, so perhaps it's all stemmed from that. Whatever the reason, I'm not the camera fetishist that Jessops are after, and am more than happy with the cracked and useless snapper on my phone. Their selection may be huge, their photo-geek staff may be knowledgeable, but it's not enough to swing it for me. Very good at what they do though, probably.","My grotesque, disgusting, and miserly appearance does not lend itself well to the medium of film, and so I've never really taken much to the art of photos. There's also nothing more dull than being subject to a neverending stream of Polaroids from someones tedious night out with their ""wacky"" mates, and so I tend to keep my lifetimes memories in my head, rather than resort to photographs of awkwardly posed, contrived snaps where everyone is holding up a shot glass, and has demonic eyes. I'm not sure where this dislike of artificially produced picture comes from. I do remembering an incident when I was about 10, when I loaned my brother's video camera and unearthed a somewhat disturbing recorded sequence which consisted only of him waving his cock about, so perhaps it's all stemmed from that. Whatever the reason, I'm not the camera fetishist that Jessops are after, and am more than happier with the cracked and useless snapper on my phone. Their selection may be whopping, their photographing-geek staff may be knowledgeable, but it's not enough to swing it for me. Very good at what they do though, probably.",0.8593205213546753,0.5030918717384338,0.96,"yelp-sentiment"
11,0.0,1.0,"a disappointment for those who love alternate versions of the bard , particularly ones that involve deep fryers and hamburgers .","a disappointment for those who love alternate versions of the bard , especially ones that involving deep fryers and hamburgers .",0.5293691754341125,0.5293906927108765,0.99,"mr"
18,0.0,1.0,"I'm not going to lie... When I read that Tofu Hut, the grungy, I'm-broke-but-want-kbbq-right-now AYCE restaurant opened a Japanese tapas and sushi restaurant, I was a bit hesitant. Have you SEEN the bathroom there? I was running around town with my family in tow and since it was an off hour, we decided to try it out. The interior was frankly shocking. An antiquated library meets formal study. Lots of wood work and molding everywhere. Love the interior design. Spacious and open. Full sushi bar in the back. Very nicely designed. When I asked the quiet but polite server some questions about the space, she politely responded that she didn't know. We ordered up! And how did it fare? As far as highlights and lows... -The seafood ramen was rich and generously portioned. -The breaded chicken was just awful. Seriously awful. Dry, chewy, and tasted like it was frozen an hour ago. -Bulgogi was spot on. -the okonomiyaki was such a bastardized version of real, honest-to-Japan messy goodness that is made me feel so sad. This was like a pizza version. -Everything else was pretty average aka forgettable. The general rule for doh seems that their Korean dishes are above average but the Japanese ones are just wacky and poor in execution. A lot of the dishes needed to come out when they done to ensure they were hot but since the timing of the kitchen was off or the server was waiting got a few to take, some of the dishes were cold! Now for the music. Yes, music. Clearly someone's iPod on shuffle. Now, before I get slammed for anything, I really like kpop and jpop. Super junior, GG, beast, etc. But the playlist would play one English song quietly, followed by three really loud Korean songs. Then, at 3pm on a weekday, my family and I had the pleasure of listening to some song by Nikki Minaj and Eminem featuring F bombs and lots of colorful language. Awkward. It took a long time to get all of our food and there were very few people in the restaurant. Not to mention, as customers arrived, they sandwiched us all in a row in this huge restaurant. Come on, spread us out a bit! If this restaurant works out some pretty big issues, it could be awesome. But it has a long way to go.","I'm not going to lie... When I read that Tofu Hut, the grungy, I'm-broke-but-want-kbbq-right-now AYCE restaurant opened a Japanese tapas and sushi restaurant, I was a bit hesitant. Have you SEEN the bathroom there? I was running around town with my family in tow and since it was an off hour, we decided to try it out. The interior was frankly shocking. An outmoded library meets formal study. Lots of wood work and molding everywhere. Love the interior design. Spacious and open. Full sushi bar in the back. Very nicely designed. When I asked the quiet but polite server some questions about the space, she politely responded that she didn't know. We ordered up! And how did it fare? As far as highlights and lows... -The seafood ramen was rich and generously portioned. -The breaded chicken was just gruesome. Seriously grisly. Drier, chewy, and tasted like it was frozen an hour ago. -Bulgogi was spot on. -the okonomiyaki was such a bastardized version of real, honest-to-Japan messy goodness that is made me feel so sad. This was like a pizza version. -Everything else was pretty average aka forgettable. The general rule for doh seems that their Korean dishes are above average but the Japanese ones are just wacky and poor in execution. A lot of the dishes needed to come out when they done to ensure they were hot but since the timing of the kitchen was off or the server was waiting got a few to take, some of the dishes were cold! Now for the music. Yes, music. Clearly someone's iPod on shuffle. Now, before I get slammed for anything, I really like kpop and jpop. Super junior, GG, beast, etc. But the playlist would play one English song quietly, followed by three really loud Korean songs. Then, at 3pm on a weekday, my family and I had the pleasure of listening to some song by Nikki Minaj and Eminem featuring F bombs and lots of colorful language. Awkward. It took a long time to get all of our food and there were very few people in the restaurant. Not to mention, as customers arrived, they sandwiched us all in a row in this huge restaurant. Come on, spread us out a bit! If this restaurant works out some pretty big issues, it could be awesome. But it has a long way to go.",0.9590178728103638,0.6642022132873535,0.97,"yelp-sentiment"
56,1.0,0.0,"The story is about a little girl growing up in colonial Africa, but it is so much more than that. Anyone growing up in the South would experience the same things. A longing for another, one of a different race, that cannot be consummated. Even a glance is forbidden. There are no words needed. Their facial expressions say everything. It is the story of a black servant, Prote (Isaach De Bankol) and a white woman, Aime (Giulia Boschi). Their desire for each other is so strong that they torture each other because they cannot have each other. The little girl, France (Ccile Ducasse) is lonely and spends all her time with Prote. She really can't see this dance. One of the more irritating aspects of the film is the laziness of the colonials. They cannot even get undressed for bed by themselves. There world is about to end; they just don't know it yet. Their racist attitudes will be erased with their presence. I think I would like to visit this Africa. It seems so quiet; especially at night when you only hear the animals.","The story is about a little girl growing up in colonial Africa, but it is so much more than that. Anyone growing up in the South would experience the same things. A longing for another, one of a different race, that cannot be consummated. Even a glance is proscribed. There are no words requisite. Their facial expression said everything. It is the story of a black servant, Prote (Isaach De Bankol) and a white woman, Aime (Giulia Boschi). Their desire for each other is so strong that they torture each other because they cannot have each other. The little girl, France (Ccile Ducasse) is lonely and spends all her time with Prote. She really can't see this dancing. One of the more irritating aspects of the film is the laziness of the colonials. They cannot even get undressed for bed by themselves. There world is about to end; they just don't know it yet. Their racist attitudes will be erased with their presence. I think I would like to visit this Africa. It seems so quiet; notably at night when you only hear the animals.",0.769119381904602,0.5040830373764038,0.98,"imdb"
21,1.0,0.0,"Located off the strip, but 5 minute walk from Planet Hollywood. We had an employee discount so $400 for 2 nights, in a 2 bedroom, 2 bath, kitchen, pretty nice suite. You can't complain about that! The view from the 38th pool/outdoor bar is nice. The pool area is kind of weak. Very small. The rooms are nice. The cleaning isn't that great. They didn't even make my bed (well I slept on the couch, but you get my point). The place wasn't really cleaned in between days. The horrible thing is: Check-out is at 10 AM (although they extended it to 11). Check-in was at 4 PM, although we got our room at around 2:30ish after our 12-hour gambling marathon.","Located off the strip, but 5 minute walk from Planet Hollywood. We had an employee discount so $400 for 2 nights, in a 2 bedroom, 2 bath, kitchen, pretty nice suite. You can't complain about that! The view from the 38th pool/outdoor bar is nice. The pool area is sorts of weak. Very small. The rooms are nice. The cleaning isn't that great. They didn't even make my bed (well I slept on the couch, but you get my point). The place wasn't really cleaned in between days. The horrible thing is: Check-out is at 10 AM (although they extended it to 11). Check-in was at 4 PM, although we got our room at around 2:30ish after our 12-hour gambling marathon.",0.5787490606307983,0.5090868473052979,0.96,"yelp-sentiment"
