"Unnamed: 0","label_1","label_2","passage_1","passage_2","score_1","score_2","SE_Thresh","dataset"
67,1.0,0.0,"""Flavia, la monaca muslmana"" aka. ""Flavia the Heretic"" of 1974 is a truly disturbing and uncompromising piece of Italian Exploitation cinema that, to a certain extent, follows a somewhat feminist premise (though the level of sleaze and brutality would probably disgust the majority of feminists). Set mostly in a convent, and with a nun as the eponymous central protagonist (great performance by the wonderful Florinda Bolkan), ""Flavia the Heretic"" may be referred to as a 'Nunsploitation' film. However, this film differs quite drastically from the typical Nunsploitation flicks from the time, as it doesn't so much focus on the nunsploitation elements such as lesbianism, sadistic lesbian punishments, etc. Personally, I saw more similarities to the Hexploitation flicks of the time, such as ""Mark of The Devil"", (even though this one doesn't treat the topic of witch-hunts), which focus on the brutal execution of Christian fundamentalism in the middle ages and early modern period. Italy around 1600: After witnessing her despotic father behead a wounded Muslim soldier, young Flavia is forced to become a nun in a convent. When her father condemns a fellow nun to a torturous death for a small misdemeanor years later, Falvia's disgust with male violence against women turns into hatred against the despotic church, and she joins a band of Arabic scavengers... One thing is for sure, ""Flavia the Heretic"" is not for the faint-hearted, and neither is it for those who want happy endings. Director Gianfranco Mingozzi obviously tried to make his film as realistic and disturbing as possible, especially in its nasty scenes. The many torture- and execution-scenes are extremely disturbing, with skinnings, spikings and other gruesome scenes in explicit detail, the most shocking scene probably being the torture of the young nun quite in the beginning of the film. The violence here is never superfluous, however. After all, this gruesome methods actually were reality in the time the film is set in. The film is very well-made, with realistic costumes, fantastic settings an elegant cinematography and a great score by Nicola Piovani. The stunningly beautiful and great Florinda Bolkan has proved her talent in many great Italian cult-productions (including Lucio Fulci's Giallo-masterpiece ""Non Si Sevizia Un Paperino"" of 1972). She delivers another great, charismatic performance here, and I couldn't imagine another actress fitting as well in the role as she does. The film has some minor inconsistencies (E.g. why does the rigid church let bizarre cult-followers into convents in the first place). However, it is overall amazing how realistic this film is. ""Flavia the Heretic"" should definitely not be missed by my fellow fans of Italian Exploitation Cinema. This is a great Exploitation flick overall, though it definitely is a deeply depressing one and therefore should be watched in the right mood. Highly recommended to fans of disturbing exploitation cinema. 7.5/10","""Flavia, la monaca muslmana"" aka. ""Flavia the Heretic"" of 1974 is a truly troubling and uncompromising piece of Italian Exploitation cinema that, to a certain extent, follows a somewhat feminist premise (though the level of sleaze and brutality would probably disgust the majority of feminists). Set mostly in a convent, and with a nun as the eponymous central protagonist (great performance by the wonderful Florinda Bolkan), ""Flavia the Heretic"" may be referred to as a 'Nunsploitation' film. However, this film differs quite drastically from the typical Nunsploitation flicks from the time, as it doesn't so much focus on the nunsploitation elements such as lesbianism, sadistic lesbian punishments, etc. Personally, I saw more similarities to the Hexploitation flicks of the time, such as ""Mark of The Devil"", (even though this one doesn't treat the topic of witch-hunts), which focus on the brutal execution of Christian fundamentalism in the middle ages and early modern period. Italy around 1600: After witnessing her despotic father behead a wounded Muslim soldier, young Flavia is forced to become a nun in a convent. When her father condemns a fellow nun to a torturous death for a small misdemeanor years later, Falvia's disgust with male violence against women turns into hatred against the despotic church, and she joins a band of Arabic scavengers... One thing is for sure, ""Flavia the Heretic"" is not for the faint-hearted, and neither is it for those who want happy endings. Director Gianfranco Mingozzi obviously tried to make his film as realistic and disturbing as possible, especially in its nasty scenes. The many torture- and execution-scenes are extremely disturbing, with skinnings, spikings and other gruesome scenes in explicit detail, the most shocking scene probably being the torture of the young nun quite in the beginning of the film. The violence here is never superfluous, however. After all, this gruesome methods actually were reality in the time the film is set in. The film is very well-made, with realistic costumes, fantastic settings an elegant cinematography and a great score by Nicola Piovani. The stunningly beautiful and great Florinda Bolkan has proved her talent in many great Italian cult-productions (including Lucio Fulci's Giallo-masterpiece ""Non Si Sevizia Un Paperino"" of 1972). She delivers another great, charismatic performance here, and I couldn't imagine another actress fitting as well in the role as she does. The film has some minor inconsistencies (E.g. why does the rigid church let bizarre cult-followers into convents in the first place). However, it is overall amazing how realistic this film is. ""Flavia the Heretic"" should definitely not be missed by my fellow fans of Italian Exploitation Cinema. This is a great Exploitation flick overall, though it definitely is a deeply depressing one and therefore should be watched in the right mood. Highly recommended to fans of disturbing exploitation cinema. 7.5/10",0.6560693979263306,0.6131434440612793,0.98,"imdb"
6,0.0,1.0,"an uneven film dealing with too many problems to be taken seriously .","an uneven film deal with too many problems to be taken seriously .",0.5725924372673035,0.8956670761108398,0.99,"mr"
29,1.0,0.0,"A classic series that should be at least repeated or released on DVD.Billy Toth,after realising he is adopted after the death of his parents,embarks on a journey to find his real parents.After various rites of passage,his search culminates in the discovery that his fathers identity was stolen and used by a human trafficker in Europe!If i remember correctly,the series ends on the Austrian(?] ski slopes and a cliff top chase resulting in the death of Billys fathers betrayer. This series was all filmed on location in various destinations round Europe and appeared polished and incredibly well made with some episodes crossing into the realms of film noir and crime thriller.The main arc was often eclipsed by the slices of life that Billy went through during his years of toiling to find his mother and fathers secrets.A class act but underrated and forgotten.","A classic series that should be at least repeated or released on DVD.Billy Toth,after realizing he is adopted after the deaths of his parents,embarks on a voyage to find his actual parents.After assorted rites of passage,his quest culminates in the discovery that his fathers identity was stealing and used by a human trafficker in Europe!If i remember correctly,the series ends on the Austrians(?] ski slopes and a cliff top pursues resulting in the deaths of Billys father betrayer. This series was all filmed on placements in dissimilar destination rounded Europe and appeared polished and terribly well made with some episodes crossing into the realm of filmmaking noir and crime thriller.The main arc was frequently dwarfed by the slices of vie that Billy went through during his yr of toiling to find his mummy and fathers undercover.A class acts but underrated and forgotten.",0.9769263863563538,0.5118861794471741,0.96,"imdb"
30,1.0,0.0,"The tweedy professor-types thought they had it all figured out. Today's peoples who inhabit Polynesia descended from migratory Asians, intrepidly moving from the Far East, island to island, eastward into Tahiti and all the other exotic tropic isles of the South Pacific over thousands of years. But the established thinking just didn't sit well with young Norwegian ethnographer Thor Heyerdahl. If that explanation were true, how come some folks born and bred in those islands have traditions, artwork, and physical features resembling not those from Asia, but South America? How can the vegetation of Ecuador, Peru and Chile look so much like what you'd find on the island several thousand miles away? Is it just a coincidence that the Islanders point out to sea in the direction of South America and say that is where their ancestors came from, led by Tiki, their equivalent of Adam? Meanwhile, how is it Norwegians speak of Scandanavian forerunners who were chased from the South American continent they had colonized, and, together with some of the native peoples they befriended, set off over the sea -- heading WEST? It's all too much to be a coincidence to Heyerdahl. With an amazing amount of moxie, a handful of crewmen, and the local know-how for traditional raft-building, an expedition begins. It's as much a trip into the human imagination as it is a pseudo-scientific demonstration that such a journey is possible with only the very basics of tools and seamanship. The Oscar-winning documentary may be dated in its tone and Anglo-ethnocentric approach, but it soars with a spirit of adventure besting even the space program that launched a decade later, as men are willing to risk it all to test a theory they think is true. Wonderful. Do yourself a favor and read the book first. It is an amazing page-turner and the perfect setup for the newsreel-style movie.","The tweedy professor-types thought they had it all figured out. Today's peoples who inhabit Polynesia descended from migratory Asians, intrepidly moving from the Far East, island to island, eastward into Tahiti and all the other exotic tropic isles of the South Pacific over thousands of years. But the established thinking just didn't sit well with young Norwegian ethnographer Thor Heyerdahl. If that explanation were true, how come some folks born and bred in those islands have traditions, artwork, and physical features resembling not those from Asia, but South America? How can the vegetation of Ecuador, Peru and Chile look so much like what you'd find on the island several thousand miles away? Is it just a coincidence that the Islanders point out to sea in the direction of South America and say that is where their ancestors came from, led by Tiki, their equivalent of Adam? Meanwhile, how is it Norwegians speak of Scandanavian forerunners who were chased from the South American continent they had colonized, and, together with some of the native peoples they befriended, set off over the sea -- heading WEST? It's all too much to be a coincidence to Heyerdahl. With an unbelievable amount of moxie, a handful of crewmen, and the local know-how for traditional raft-building, an expedition begins. It's as much a trip into the human imagination as it is a pseudo-scientific demonstration that such a journey is possible with only the very basics of tools and seamanship. The Oscar-winning documentary may be dated in its tone and Anglo-ethnocentric approach, but it soars with a spirit of adventure besting even the space program that launched a decade later, as men are willing to risk it all to test a theory they think is true. Wonderful. Do yourself a favor and read the book first. It is an amazing page-turner and the perfect setup for the newsreel-style movie.",0.7934366464614868,0.5452503561973572,0.96,"imdb"
25,0.0,1.0,"essentially "" fatal attraction "" remade for viewers who were in diapers when the original was released in 1987 . . . . this story gets sillier , not scarier , as it goes along . . .","predominantly "" fatal attraction "" remade for viewers who were in diapers when the original was released in 1987 . . . . this story obtains sillier , not scarier , as it goes along . . .",0.873738706111908,0.5596257448196411,0.96,"mr"
67,1.0,0.0,"The year 2000 had been a bad year for indian films due to lack of quality and imagination from film directors. Other than Mohabbatein and Kaho Naa Pyaar Hai nothing stood out. CCCC had lot of contraversy due to the financing of the film and this with not really knowing what the film is about has generated good publicity and advanced ticket sales for the film around India and Abroad. The only information given was that it was a suspense thriller. The film is now been released in 2001 and the film was surprisingly quite good. The main plot is to do with surrogacy and is well handled. Salman And Preiti give a good performance where Salman doesn't actually take is shirt off at all..must be special effects!! Rani plays Salmans wife but it is slightly a less demanding role compared with Preiti who plays Prostitute who eventually becomes the surrogate mother. The three main leads confirm, after Har Di Jo Pyar Karega, they have a solid on screen and off screen chemistry(apparently). Salman Khan who is excellent plays a serious role in the film as a successful business man and is a pity is being exploited as a wannabe comedian in his other films as he is quite underrated in the Mumbai film industry partly due to the films he chooses. Rani's Character does not know Preiti is a prostitute until the end...this kept from her and the rest of the family...the rest you should find out as it will ruin the film if i told you. The songs are all picturised well especially dekhne walon and the main title song. The other supporting actors do a minimal but fine effort as Salmans loving family. Abbas Mastan has produced a hit and handled the film subject tactfully..I say go and watch it or rent it whatever you prefer!","The year 2000 ha been a bad year for indian movie due to lack of quality and imagination from film directors. Other than Mohabbatein and Kaho Naa Pyaar Hai nothing stood out. CCCC ha lot of contraversy due to the financing of the film and this with not really aware what the film is about has generated good publicity and advanced ticket sales for the film around India and Abroad. The only information afforded was that it was a suspense thriller. The film is now been releasing in 2001 and the movie was shockingly abundantly good. The main plot is to do with surrogacy and is well handled. Salman And Preiti give a good performance where Salman doesn't actually take is shirt off at all..must be special effects!! Rani plays Salmans wife but it is marginally a less demanding role compared with Preiti who plays Prostitute who eventually becomes the surrogate mother. The three main leads confirming, after Har Di Jo Pyar Karega, they have a solid on screen and off screen chemistry(apparently). Salman Khan who is fabulous plays a serious role in the films as a successful business man and is a pity is being exploited as a wannabe comedian in his other film as he is quite underrated in the Mumbai film industry partly due to the films he chooses. Rani's Character does not know Preiti is a prostitute until the end...this kept from her and the rest of the family...the rest you should find out as it will ruin the film if i told you. The songs are all picturised well especially dekhne walon and the main title song. The other supporting actors do a minimal but fine effort as Salmans loving family. Abbas Mastan has produced a hit and handled the film subject tactfully..I say go and watch it or rent it whatever you prefer!",0.8717941045761108,0.5035540461540222,0.96,"imdb"
14,0.0,1.0,"while holm is terrific as both men and hjejle quite appealing , the film fails to make the most out of the intriguing premise .","while holm is wonderful as both male and hjejle pretty appealing , the movie fail to make the most out of the riveting premise .",0.9721590876579284,0.7699568271636963,0.97,"mr"
17,1.0,0.0,"a brutally honest documentary about a much anticipated family reunion that goes wrong thanks to culture shock and a refusal to empathize with others .","a viciously honest documentary about a much anticipate family reunion that goes incorrect thank to culture shock and a refuse to sympathize with others .",0.9959171414375304,0.6965745091438293,0.97,"mr"
14,1.0,0.0,"This is the second Eytan Fox film I have seen. The fantastic actor, Lior Ashkenazi, who starred in Walk on Water, has a minor role in this film also. But the real stars are the young Israelis who live together in a tiny apartment - Noam (Ohad Knoller), Lulu (Daniela Virtzer), and Yelli (Alon Friedman); and the Palestinian that joins them off and on - Ashraf (Yousef 'Joe' Sweid). There is sort of a Friends/Sex in the City thing going on (mostly gay), and they all just want the war to end so they can go on with their lives in peace. But, that's the rub. No matter how many posters you put up or how many raves for peace you have, the war is not going to end. Many have tried over the years to bring the two sides to the table, but they just want to keep it going for whatever reason. There are many on the Israeli side, both there and here in the US, who just want it all and will not consider peace. There are many on the Palestinian side who apparently would be out of a job should peace ever come. It is in no one's interest to end this war, and the children suffer. This is always on your mind as you watch this funny and engaging film. It won't go away. You know something tragic is going to happen and, of course, it does. With the feelings on both sides running strong, and revenge as the motivator, tragedy always happens, and that is what makes this an adult version of Friends/Sex in the City. There is no superficiality. It is real life, and it was a beautiful thing to see.","This is the second Eytan Fox film I have seen. The sumptuous actor, Lior Ashkenazi, who starred in Walk on Water, has a minor role in this film also. But the real stars are the young Israelis who live together in a tiny apartment - Noam (Ohad Knoller), Lulu (Daniela Virtzer), and Yelli (Alon Friedman); and the Palestinian that joins them off and on - Ashraf (Yousef 'Joe' Sweid). There is sort of a Friends/Sex in the City thing going on (mostly gay), and they all just want the war to end so they can go on with their lives in peace. But, that's the rub. No matter how many posters you put up or how many raves for peace you have, the war is not going to end. Several have tried over the years to bring the two sides to the table, but they just want to keep it going for whatever reason. There are many on the Israeli side, both there and here in the US, who just want it all and will not consider peace. There are many on the Palestinian side who apparently would be out of a job should peace ever come. It is in no one's interest to end this war, and the children suffer. This is always on your mind as you watch this funny and engaging film. It won't go away. You know something tragic is going to happen and, of course, it does. With the feelings on both sides running strong, and revenge as the motivator, tragedy always happens, and that is what makes this an adult version of Friends/Sex in the City. There is no superficiality. It is real life, and it was a beautiful thing to see.",0.8856430053710938,0.5015325546264648,0.97,"imdb"
54,1.0,0.0,"i thought it was pretty interesting my social studies/language arts teacher was the police chief guy that was holding the microphone on the water barrel part =D i was excited my teacher is in some commercials he was in a gas/coffee/phone/play station commercial its nice seeing him on TV he was also on everybody hates Chris except he always get the small part la la why do we have to right 10 lines thats so stupid -_- i think I'm done never mind I'm still not done what is this a joke? why do we have to go all the way to line ten... really what's the point of it??!! i will just right random words for now -_- maple story is fun i love my friends","i thought it was pretty interesting my social studies/language arts teacher was the police chief guy that was holding the microphone on the water barrel part =D i was excited my teacher is in some commercials he was in a gas/coffee/phone/play station commercial its nice seeing him on TV he was also on everybody hates Chris except he always get the small part la la why do we have to right 10 lines thats so stupid -_- i think I'm done never mind I'm still not done what is this a joke? why do we have to go all the way to line ten... really what's the point of it??!! i will just right random words for now -_- maple story is amusing i loves my friends",0.6645520329475403,0.5088479518890381,0.96,"imdb"
4,1.0,0.0,"You'd think that a really good burger wouldn't be that tough a feat to accomplish, but surprisingly not too many places seem to be able to pull it off. In 8 or so visits in the past few months Big Daddy's has consistently been able to serve up the best burgers I've had in Charlotte. Plus, they have really good fries, excellent sweet potato fries and the ne plus ultra of potato based burger sidekicks tater tots. I'm not certain why tater tots seem to go so perfectly with burgers, whether they actually taste good or it's more of a diabolicaly insidious after effect of school cafeteria tater-tot brainwashing, but the pairing of the tots and the beef puck works. If you dig root beer try the stuff they have on tap.","You'd think that a truly good burger wouldn't be that tough a feat to accomplish, but staggeringly not too several places seem to be able to pulling it off. In 8 or so visits in the bygone few month Big Daddy's has consistently been able to serve up the best burgers I've ha in Charlotte. Plus, they have really good fries, admirable sweet potato fries and the ne anymore ultra of potato based burger sidekicks tater tots. I'm not certain why tater tots seems to go so perfectly with burgers, whether they actually taste good or it's more of a diabolicaly insidious after effect of schooling cafeteria tater-tot brainwashing, but the pairing of the tots and the beef puck works. If you dig root beer attempt the stuff they have on tap.",0.9891933798789978,0.5214730501174927,0.97,"yelp-sentiment"
